{
  "$schema": "./schema/feature.schema.json",
  "id": "essensys-temporary-password-hardening-2026-09-041",
  "title": "Durcissement post-revue du mot de passe temporaire — interface",
  "status": "proposed",
  "owner": "hermes",
  "jira": {
    "issue": "TBD",
    "test_plan": null
  },
  "git": {
    "branch": "feat/essensys-temporary-password-hardening-2026-09-041",
    "pr_url": null
  },
  "openspec": {
    "change_id": "essensys-temporary-password-hardening-2026-09-041",
    "path": "../essensys-memory/openspec/changes/essensys-temporary-password-hardening-2026-09-041",
    "proposal": "../essensys-memory/openspec/changes/essensys-temporary-password-hardening-2026-09-041/proposal.md",
    "design": "../essensys-memory/openspec/changes/essensys-temporary-password-hardening-2026-09-041/design.md",
    "tasks": "../essensys-memory/openspec/changes/essensys-temporary-password-hardening-2026-09-041/tasks.md",
    "specs": [
      "../essensys-memory/openspec/changes/essensys-temporary-password-hardening-2026-09-041/specs/forced-password-change-ui/spec.md",
      "../essensys-memory/openspec/changes/essensys-temporary-password-hardening-2026-09-041/specs/feature-manifest-truthfulness/spec.md"
    ]
  },
  "implementation": {
    "paths": [
      "site/src/lib/passwordChangeGuard.js",
      "site/src/pages/ChangePassword.jsx",
      "site/src/pages/ResetPassword.jsx",
      "site/src/pages/Login.jsx",
      "site/src/pages/Admin.jsx",
      "site/src/App.jsx",
      "site/e2e/temporary-password.spec.js",
      "features/essensys-temporary-password-2026-09-040.json"
    ],
    "primary_surface": "react-admin"
  },
  "userguide": {
    "pages": [
      "docs/features/temporary-password.md"
    ],
    "language": "fr",
    "i18n_keys": [],
    "screenshots": []
  },
  "tests": {
    "playwright": [
      "site/e2e/temporary-password.spec.js"
    ],
    "pytest": [],
    "testthat": [],
    "coverage_must_test": [
      "connexion avec mot de passe temporaire pose l'indicateur et redirige vers /change-password",
      "un 409 sur une session existante pose l'indicateur et conserve la page d'origine dans return",
      "accès direct à une autre page ramène à /change-password sans requête API",
      "retour arrière vers l'espace connecté ramène à /change-password",
      "page publique accessible malgré l'indicateur",
      "indicateur orphelin levé par un profil 200 et redirection sans ressaisie",
      "changement réussi efface l'indicateur et mène à la destination d'origine",
      "déconnexion depuis /change-password efface l'indicateur",
      "bascule d'affichage des mots de passe sur les trois champs",
      "indicateur conservé après rechargement"
    ],
    "smoke_tags": [
      "@auth",
      "@admin",
      "@ux"
    ],
    "ux_matrix": {
      "required": true,
      "devices": [
        "desktop",
        "iphone",
        "ipad"
      ],
      "targets": [
        "support"
      ],
      "required_projects": [
        "support-desktop",
        "support-iphone",
        "support-ipad"
      ],
      "screenshots_required": true,
      "visual_regression_required": true,
      "no_armoire_required": false
    }
  },
  "confluence": {
    "space": "ESSENSYS",
    "parent_page": "0",
    "template": "feature",
    "draft_page_id": null,
    "published_page_id": null
  },
  "release": {
    "changelog_entry": "Verrou structurel du changement de mot de passe imposé, destination préservée sur refus serveur, affichage des mots de passe",
    "target_tag": null,
    "surfaces": [
      "essensys-support-site"
    ],
    "paths": [
      "site/src/lib/passwordChangeGuard.js",
      "site/src/pages/ChangePassword.jsx",
      "site/src/App.jsx"
    ]
  },
  "security": {
    "sca_tool": "dependabot",
    "dependabot_alerts_url": null,
    "last_scan_at": null,
    "cve_findings": {
      "critical": 0,
      "high": 0,
      "medium": 0,
      "low": 0
    },
    "secret_scan": {
      "status": "clean",
      "tool": "gitleaks",
      "last_scan_at": null
    },
    "muted_findings": [],
    "threat_model_url": "../essensys-memory/openspec/changes/essensys-temporary-password-hardening-2026-09-041/design.md",
    "owner_security": "hermes"
  }
}
