{
  "$schema": "./schema/feature.schema.json",
  "id": "essensys-temporary-password-2026-09-040",
  "title": "Mot de passe temporaire administrateur et changement imposé — interface",
  "status": "proposed",
  "owner": "hermes",
  "jira": {
    "issue": "TBD",
    "test_plan": null
  },
  "git": {
    "branch": "feat/essensys-temporary-password-2026-09-040",
    "pr_url": null
  },
  "openspec": {
    "change_id": "essensys-temporary-password-2026-09-040",
    "path": "../essensys-memory/openspec/changes/essensys-temporary-password-2026-09-040",
    "proposal": "../essensys-memory/openspec/changes/essensys-temporary-password-2026-09-040/proposal.md",
    "design": "../essensys-memory/openspec/changes/essensys-temporary-password-2026-09-040/design.md",
    "tasks": "../essensys-memory/openspec/changes/essensys-temporary-password-2026-09-040/tasks.md",
    "specs": [
      "../essensys-memory/openspec/changes/essensys-temporary-password-2026-09-040/specs/admin-temporary-password-issue/spec.md",
      "../essensys-memory/openspec/changes/essensys-temporary-password-2026-09-040/specs/forced-password-change-ui/spec.md"
    ]
  },
  "implementation": {
    "paths": [
      "site/src/pages/UserManager.jsx",
      "site/src/components/TemporaryPasswordModal.jsx",
      "site/src/pages/ChangePassword.jsx",
      "site/src/pages/Login.jsx",
      "site/src/pages/Auth.css",
      "site/src/App.jsx"
    ],
    "primary_surface": "mixed"
  },
  "userguide": {
    "pages": [
      "docs/features/temporary-password.md"
    ],
    "language": "fr",
    "i18n_keys": [],
    "screenshots": []
  },
  "tests": {
    "playwright": [
      "site/e2e/temporary-password.spec.js"
    ],
    "pytest": [],
    "testthat": [],
    "coverage_must_test": [
      "action « Définir un mot de passe temporaire » présente dans le menu d'actions",
      "confirmation mentionne l'email visé et avertit du remplacement définitif",
      "case d'envoi par courriel proposée non cochée",
      "mot de passe affiché une seule fois, avec expiration et action de copie",
      "mot de passe non consultable après fermeture de la modale",
      "motif affiché quand l'envoi de courriel a échoué",
      "badge d'état visible dans la liste pour un compte en attente de changement",
      "connexion signalant un changement requis mène à /change-password",
      "confirmation divergente bloquée côté interface sans requête",
      "erreurs serveur distinguées : actuel erroné, trop court, identique à l'actuel",
      "changement réussi mène à l'espace connecté sans ressaisie",
      "mot de passe temporaire expiré affiché comme tel, pas comme identifiant incorrect",
      "409 password_change_required sur une session existante ramène à /change-password",
      "aucune navigation vers l'espace connecté depuis /change-password",
      "accès direct à une autre page ramène à /change-password",
      "déconnexion disponible depuis /change-password",
      "pas de défilement horizontal sur iPhone pour la page et la modale"
    ],
    "smoke_tags": [
      "@auth",
      "@admin",
      "@ux"
    ],
    "ux_matrix": {
      "required": true,
      "devices": [
        "desktop",
        "iphone",
        "ipad"
      ],
      "targets": [
        "support"
      ],
      "required_projects": [
        "support-desktop",
        "support-iphone",
        "support-ipad"
      ],
      "screenshots_required": true,
      "visual_regression_required": true,
      "no_armoire_required": false
    }
  },
  "confluence": {
    "space": "ESSENSYS",
    "parent_page": "0",
    "template": "feature",
    "draft_page_id": null,
    "published_page_id": null
  },
  "release": {
    "changelog_entry": "Émission d'un mot de passe temporaire depuis l'administration et écran de changement imposé à la première connexion",
    "target_tag": null,
    "surfaces": [
      "essensys-support-site"
    ],
    "paths": [
      "site/src/pages/UserManager.jsx",
      "site/src/components/TemporaryPasswordModal.jsx",
      "site/src/pages/ChangePassword.jsx",
      "site/src/pages/Login.jsx",
      "site/src/App.jsx"
    ]
  },
  "security": {
    "sca_tool": "dependabot",
    "dependabot_alerts_url": null,
    "last_scan_at": null,
    "cve_findings": {
      "critical": 0,
      "high": 0,
      "medium": 0,
      "low": 0
    },
    "secret_scan": {
      "status": "clean",
      "tool": "gitleaks",
      "last_scan_at": null
    },
    "muted_findings": [],
    "threat_model_url": "../essensys-memory/openspec/changes/essensys-temporary-password-2026-09-040/design.md",
    "owner_security": "hermes"
  }
}
